applicant_num,work_dates,position,employer,address,responsibilities,salary
1,2016-2018,Financial Assistant ,BDO ,"7899 Makati Avenue, Makati City. ",Assisting with audits ,20690
1,2019-Present,Loan Operations Assistant,Land Bank,"AFP Gen. Insurance Corporation Bldg., Bonny Serrano Road cor. EDSA, Camp Aguinaldo, Quezon City",Assisting in processing of loan applications,47000
2,2022-Present,Executive Assistant,Land Bank,"32/F, LANDBANK Plaza 1598 M.H. del Pilar Dr. J. Quintos St. Malate, Manila",Managing expense reports,20200
3,2020-Present,Financial Assistant,Land Bank,"151 Samson Road, Caloocan City, Metro Manila",Preparing financial reports,21450
4,2015-Present,Financial Assistant,Land Bank,"Novaliches, Quezon City, Metro Manila",Preparing financial reports,55000
5,2019-Present,Public Relations Officer,City Government of Quezon City,Quezon City Hall,Managing public relations,35000
